{
  "dateRaised": 20190101,
  "affectedFirmware": ["plane"],
  "hardwareLimited": [],
  "description": "This is an example open issue for Plane only, V3.9.5 and above",
  "mitigation": "Put the temporary mitigation here",
  "fixCommit": [],
  "dateResolved": null,
  "linkedIssue": "https://github.com/ArduPilot/ardupilot/issues",
  "linkedInfo": ["www.ardupilot.com", "https://discuss.ardupilot.org/"],
  "linkedPR": null,
  "versionFrom": {"plane": "3.9.5"},
  "versionFixed": {},
  "criticality": 3
}
